学科_顺序	学科	具体	号	课题	具体_方向	index	index_all
3	理论经济	False	62	理顺金融市场间利率传导机制研究		61	302
3	理论经济	False	63	完善各类国有资产管理体制研究		62	303
3	理论经济	False	64	促进中小民营企业发展研究		63	304
3	理论经济	False	65	鼓励民营企业开展和参与基础性创新研究		64	305
3	理论经济	False	66	制造业服务化对产业升级的影响研究		65	306
3	理论经济	False	67	知识产权保护与企业创新研究		66	307
3	理论经济	False	68	大数据方法与宏观经济运行预警体系研究		67	308
3	理论经济	False	69	人工智能与服务业高质量发展研究		68	309
3	理论经济	False	70	人工智能与劳动密集型行业转型研究		69	310
3	理论经济	False	71	数字经济环境下市场有效性和公平性研究		70	311
3	理论经济	False	72	深化土地要素市场化改革研究		71	312
3	理论经济	False	73	深化劳动力市场化资源配置研究		72	313
3	理论经济	False	74	新型城镇化与乡村振兴战略研究		73	314
3	理论经济	False	75	京津冀协同发展研究		74	315
3	理论经济	False	76	长江三角洲区域一体化发展研究		75	316
3	理论经济	False	77	长江经济带发展研究		76	317
3	理论经济	False	78	新时期国际经贸环境变化趋势及应对策略研究		77	318
3	理论经济	False	79	扩大进口与经济高质量发展关系研究		78	319
3	理论经济	False	80	中国企业国际化战略研究		79	320
3	理论经济	False	81	贸易摩擦背景下中国企业风险对冲策略研究		80	321
3	理论经济	False	82	中国对外投资保护问题研究		81	322
3	理论经济	False	83	“一带一路”沿线国家资源走廊建设与利益共享机制研究		82	323
3	理论经济	False	84	扩大区域开放与合作研究		83	324
3	理论经济	False	85	中国境外经贸合作区发展研究		84	325
3	理论经济	False	86	中国跨境支付体系建设研究		85	326
3	理论经济	False	87	全球产业链调整新趋势研究		86	327
3	理论经济	False	88	西方发达国家新一轮贸易保护主义研究		87	328
4	应用经济	True	1	我国经济高质量发展的指标体系研究	*	0	329
4	应用经济	True	2	推动经济高质量发展的制度环境和政策体系优化研究	*	1	330
4	应用经济	True	3	经济高质量发展的产业政策转型研究	*	2	331
4	应用经济	True	4	我国现阶段需求总量和结构状况及其变动趋势研究	*	3	332
4	应用经济	True	5	新形势下我国宏观调控体系研究	*	4	333
4	应用经济	True	6	我国全面建立绩效预算制度研究	*	5	334
4	应用经济	True	7	新形势下财政政策与货币政策协调研究	*	6	335
4	应用经济	True	8	我国地方政府隐性债务风险研究	*	7	336
4	应用经济	True	9	去杠杆进程中地方政府债务管控研究	*	8	337
4	应用经济	True	10	政府投资体制改革与推进PPP模式研究	*	9	338
4	应用经济	True	11	中央与地方财政支出责任研究	*	10	339
4	应用经济	True	12	深化增值税制度改革研究	*	11	340
4	应用经济	True	13	“放管服”改革经济影响评估研究	*	12	341
4	应用经济	True	14	“减税降费”的政策评估研究	*	13	342
4	应用经济	True	15	个人所得税改革影响研究	*	14	343
4	应用经济	True	16	我国消费税改革研究	*	15	344
4	应用经济	True	17	工业化后期阶段产业结构变动趋势研究	*	16	345
4	应用经济	True	18	推进我国服务业开放研究	*	17	346
4	应用经济	True	19	我国产业基金发展状况与管理研究	*	18	347
4	应用经济	True	20	促进房地产市场稳定发展的长效机制研究	*	19	348
4	应用经济	True	21	新能源发展战略研究	*	20	349
4	应用经济	True	22	促进制造业绿色转型的政策体系研究	*	21	350
4	应用经济	True	23	重大基础设施、基本公共服务中的政府定价研究	*	22	351
4	应用经济	True	24	“一带一路”背景下新能源汽车发展战略研究	*	23	352
4	应用经济	True	25	深化电力体制改革研究	*	24	353
4	应用经济	True	26	新时期区域产业分工与高质量发展研究	*	25	354
4	应用经济	True	27	健全房地产交易透明机制研究	*	26	355
4	应用经济	True	28	发展混合所有制经济研究	*	27	356
4	应用经济	True	29	我国营商环境优化战略研究	*	28	357
4	应用经济	True	30	竞争中立原则与国有企业改革研究	*	29	358
4	应用经济	True	31	企业竞争与资源配置效率研究	*	30	359
4	应用经济	True	32	加强保护民营企业财产所有权研究	*	31	360
4	应用经济	True	33	企业并购重组中的会计和审计问题研究	*	32	361
4	应用经济	True	34	股权质押、公司治理与财务风险预警研究	*	33	362
4	应用经济	True	35	促进民营经济发展的财税政策研究	*	34	363
4	应用经济	True	36	支持重点耐用消费品租赁的信用和保险机制研究	*	35	364
4	应用经济	True	37	国有资本授权经营制度研究	*	36	365
4	应用经济	True	38	以改革激发国有企业活力研究	*	37	366
4	应用经济	True	39	充分发挥企业家作用的制度和政策研究	*	38	367
4	应用经济	True	40	公用事业领域深化国资国企改革研究	*	39	368
4	应用经济	True	41	国家生育政策调整对家庭生育及劳动力市场供给的影响研究	*	40	369
4	应用经济	True	42	全面提升劳动力素质解决就业结构性矛盾问题研究	*	41	370
4	应用经济	True	43	缩小财产和收入差距合理有效途径研究	*	42	371
4	应用经济	True	44	跨行政区的经济区域发展机制建设研究	*	43	372
4	应用经济	True	45	国家公园管理体制与区域经济发展研究	*	44	373
4	应用经济	True	46	特大城市空间布局研究	*	45	374
4	应用经济	True	47	推进西部大开发形成新格局研究	*	46	375
4	应用经济	True	48	加快东北老工业基地振兴研究	*	47	376
4	应用经济	True	49	粤港澳大湾区协同发展研究	*	48	377
4	应用经济	True	50	发挥自贸试验区引领高水平开放作用研究	*	49	378
4	应用经济	True	51	参与全球产业链竞争对策研究	*	50	379
4	应用经济	True	52	我国参与全球治理对策研究	*	51	380
4	应用经济	True	53	当前国际资本流动新特点研究	*	52	381
4	应用经济	True	54	提高我国投资效率研究	*	53	382
4	应用经济	True	55	新形势下金融开放问题研究	*	54	383
4	应用经济	True	56	经济下行压力加大条件下防范金融风险研究	*	55	384
4	应用经济	True	57	适应经济高质量发展的金融改革研究	*	56	385
4	应用经济	True	58	互联网金融市场风险及行业监管应对研究	*	57	386
4	应用经济	True	59	我国对外投资安全与质量问题研究	*	58	387
4	应用经济	True	60	我国自由贸易区战略研究	*	59	388
4	应用经济	True	61	探索建设中国特色自由贸易港研究	*	60	389
4	应用经济	True	62	我国维护多边经贸规则问题研究	*	61	390
4	应用经济	True	63	我国内需主导的进口战略研究	*	62	391
4	应用经济	True	64	我国扩大进口对国际贸易格局的影响研究	*	63	392
4	应用经济	True	65	国际多边贸易体制改革与我国对策研究	*	64	393
4	应用经济	True	66	稳外贸对策研究	*	65	394
4	应用经济	True	67	稳外资对策研究	*	66	395
4	应用经济	True	68	推动进一步发展中非经贸关系研究	*	67	396
4	应用经济	True	69	“一带一路”建设中相关国家债务风险研究	*	68	397
4	应用经济	True	70	中美经济关系变化趋势研究	*	69	398
4	应用经济	True	71	中美贸易关系新形势下的预期管理问题研究	*	70	399
4	应用经济	True	72	美国货币、税收政策对我国经济发展影响研究	*	71	400
4	应用经济	True	73	中美贸易关系新形势下我国先进制造业应对策略及转型升级路径研究	*	72	401
4	应用经济	True	74	深化生态环境监管体制改革研究	*	73	402
4	应用经济	True	75	健全自然资源监管体制机制研究	*	74	403
4	应用经济	True	76	绿色发展的国际合作研究	*	75	404
4	应用经济	True	77	京津冀绿色发展路径研究	*	76	405
4	应用经济	True	78	健全生态补偿机制研究	*	77	406
4	应用经济	True	79	重点生态功能区配套政策研究	*	78	407
4	应用经济	True	80	土地规划管理体制国际比较研究	*	79	408
4	应用经济	True	81	协调推进新型城镇化与乡村振兴战略研究	*	80	409
4	应用经济	True	82	乡村振兴战略背景下产业发展投融资创新机制研究	*	81	410
4	应用经济	True	83	农村金融服务乡村振兴战略研究	*	82	411
4	应用经济	True	84	促进新型农村集体经济发展研究	*	83	412
4	应用经济	True	85	深化农村集体产权制度改革研究	*	84	413
4	应用经济	True	86	农村宅基地三权分置改革的政策评估研究	*	85	414
4	应用经济	True	87	城乡统筹推进农村生态环境治理保护研究	*	86	415
4	应用经济	True	88	农业农村优先发展的体制机制与政策体系研究	*	87	416
4	应用经济	True	89	小农户生产和现代农业发展有机衔接研究	*	88	417
4	应用经济	True	90	新形势下我国粮食安全研究	*	89	418
4	应用经济	True	91	农产品国际贸易变化的影响与对策研究	*	90	419
4	应用经济	True	92	深化农村土地制度改革研究	*	91	420
4	应用经济	True	93	乡村旅游业发展的国际经验和我国发展策略研究	*	92	421
4	应用经济	True	94	乡村振兴与妇女发展研究	*	93	422
4	应用经济	True	95	土地流转对妇女生计影响研究	*	94	423
4	应用经济	True	96	城乡户籍制度与土地制度联动并轨的目标及路径研究	*	95	424
4	应用经济	True	97	城乡基础设施和基本公共服务均等化的财政保障体系研究	*	96	425
4	应用经济	True	98	建成可持续、多层次社会保障体系研究	*	97	426
4	应用经济	True	99	农业转移人口市民化政策体系研究	*	98	427
5	统计学	True	1	基于R&D等核算改革的我国生产率测算研究	*	0	428
5	统计学	True	2	基于大数据的宏观经济数据质量监测评价研究	*	1	429
5	统计学	True	3	我国环境政策效应的测度与评价研究	*	2	430
5	统计学	True	4	大数据背景下我国新产业新业态新模式统计监测研究	*	3	431
5	统计学	True	5	供给侧结构性改革与我国能源发展质量效率的测度研究	*	4	432
5	统计学	True	6	杠杆率测度与结构性优化研究	*	5	433
5	统计学	True	7	高质量增长约束下我国能源资源优化配置的统计测度研究	*	6	434
5	统计学	True	8	“一带一路”沿线国家投资风险的统计研究	*	7	435
5	统计学	True	9	环保税政策有效性统计研究	*	8	436
5	统计学	True	10	基于多数据源的我国脱贫过程监测方法研究	*	9	437
5	统计学	True	11	国际进口博览会经济社会效应研究	*	10	438
5	统计学	True	12	制造业有效创新对价值链上移的作用研究	*	11	439
5	统计学	True	13	基于科技进步统计监测的科技创新中心评价研究	*	12	440
5	统计学	True	14	现代旅游业发展监测方法与中国旅游卫星账户研究	*	13	441
5	统计学	True	15	农业转移人口市民化测度及其空间分布研究	*	14	442
5	统计学	True	16	“以房养老”的财富代际传递效应测度研究	*	15	443
5	统计学	True	17	居民住房消费与自有住房服务核算研究	*	16	444
5	统计学	True	18	地方政府财政风险监测与预警的统计研究	*	17	445
5	统计学	True	19	多源审计数据的信息重构与融合技术建模研究	*	18	446
5	统计学	True	20	超高维数据网络模型及其在金融市场风险应用研究	*	19	447
5	统计学	True	21	统计数据工程专业人才创新能力评价研究	*	20	448
5	统计学	True	22	国际比较中的国家与区域链接问题研究	*	21	449
5	统计学	False	23	国家与地区治理能力指标体系深化研究		22	450
5	统计学	False	24	资金流量与存量核算方法及应用研究		23	451
5	统计学	False	25	深化潜在增长率测度研究		24	452
5	统计学	False	26	服务业产出和价格测度研究		25	453
5	统计学	False	27	多视角深化通货膨胀测度研究		26	454
5	统计学	False	28	我国经济高质量发展的测度与驱动因素研究		27	455
5	统计学	False	29	我国民营经济发展相关问题的统计研究		28	456
5	统计学	False	30	宏观经济政策效应的测度、比较与评价研究		29	457
5	统计学	False	31	知识分享的统计测度与核算研究		30	458
5	统计学	False	32	数字经济相关统计问题研究		31	459
5	统计学	False	33	国际比较统计方法与应用研究		32	460
5	统计学	False	34	民生福祉测度及其提升路径研究		33	461
5	统计学	False	35	我国人口生育政策调整的效应研究		34	462
5	统计学	False	36	产业统计国际准则与中国改革及其应用研究		35	463
5	统计学	False	37	无形资产测度研究		36	464
5	统计学	False	38	中国资产负债表的编制与应用研究		37	465
5	统计学	False	39	国际贸易统计方法及主要经济体贸易比较研究		38	466
5	统计学	False	40	知识型、技能型、创新型劳动力核算体系研究		39	467
5	统计学	False	41	我国收入分配统计的完善研究		40	468
5	统计学	False	42	贸易依存度、关税效应与经济增长路径研究		41	469
5	统计学	False	43	生活质量与幸福感测度研究		42	470
5	统计学	False	44	我国乡村振兴相关问题的统计研究		43	471
5	统计学	False	45	我国老龄化社会相关问题的统计研究		44	472
5	统计学	False	46	我国生态环境治理相关问题的统计研究		45	473
5	统计学	False	47	政府统计大数据应用研究		46	474
5	统计学	False	48	传统与非传统数据源的融合路径和综合应用研究		47	475
5	统计学	False	49	基于多源异构网络大数据的经济行为智能分析研究		48	476
5	统计学	False	50	就业质量的测度与评价研究		49	477
5	统计学	False	51	我国不同收入群体的统计界定与规模测算研究		50	478
5	统计学	False	52	大数据背景下的妇女流动研究		51	479
5	统计学	False	53	基于大数据的商业个体行为测度与景气监测研究		52	480
5	统计学	False	54	特征价格方法与应用深化研究		53	481
5	统计学	False	55	新经济形势下政府统计中的抽样理论方法与应用研究		54	482
5	统计学	False	56	基于网络大数据的群体智能信息安全评价研究		55	483
5	统计学	False	57	复杂数据在线监测与建模分析方法在社会经济中的应用研究		56	484
5	统计学	False	58	Meta模型的理论方法在社会经济大数据分析中的应用研究		57	485
5	统计学	False	59	大数据背景下随机抽样技术及统计推断方法研究		58	486
5	统计学	False	60	动态及多目标总体抽样方法与应用研究		59	487
5	统计学	False	61	混频数据建模方法在社会科学中的应用研究		60	488
5	统计学	False	62	大数据背景下统计新理论、新方法研究		61	489
6	政治学	True	1	习近平新时代中国特色社会主义思想对马克思主义国家学说的继承和发展研究	*	0	490
6	政治学	True	2	习近平新时代中国特色社会主义思想对马克思主义民主思想的继承和发展研究	*	1	491
6	政治学	True	3	习近平新时代中国特色社会主义思想对于马克思主义政党理论的继承和发展研究	*	2	492
6	政治学	True	4	中国特色社会主义政治学学科体系、学术体系和话语体系研究	*	3	493
6	政治学	True	5	中国特色社会主义政治学建设的基本学术命题、学术思想和学术观点研究	*	4	494
6	政治学	True	6	中国特色社会主义政治学新表述、新范畴、新概念研究	*	5	495
6	政治学	True	7	新时代党的政治建设目标、任务和路径研究	*	6	496
6	政治学	True	8	新时代完善地方党委和部门党组对重大工作的领导体制机制研究	*	7	497
6	政治学	True	9	新时代建立健全新型经济组织和社会组织中党的组织机构研究	*	8	498
6	政治学	True	10	新时代党领导政府的体制机制研究	*	9	499
6	政治学	True	11	新时代党领导人民代表大会的体制机制研究	*	10	500
6	政治学	True	12	新时代党领导人民政协的体制机制研究	*	11	501
6	政治学	True	13	新时代中国特色社会主义政治话语传播策略研究	*	12	502
6	政治学	True	14	新时代干部选拔体制与机制的改革和优化研究	*	13	503
6	政治学	True	15	新时代提升领导干部政治素质和治理能力的实证研究	*	14	504
6	政治学	True	16	新时代干部容错纠错机制研究	*	15	505
6	政治学	True	17	新时代基层公务员激励机制研究	*	16	506
6	政治学	True	18	新时代深化行政改革和全面转变政府职能研究	*	17	507
6	政治学	True	19	新时代国家机关事务管理效能研究	*	18	508
6	政治学	True	20	新时代完善优化党委和政府责任制度研究	*	19	509
6	政治学	True	21	新时代爱国统一战线的机制创新研究	*	20	510
6	政治学	True	22	新时代构建联系广泛服务群众的群团工作体系研究	*	21	511
6	政治学	True	23	新时代构建和完善地方监察体系研究	*	22	512
6	政治学	True	24	新时代政府信用建设与政府公共关系优化研究	*	23	513
6	政治学	True	25	新时代地方政府债务监管体制研究	*	24	514
6	政治学	True	26	新时代基层政治稳定与风险管控研究	*	25	515
6	政治学	True	27	新时代提升地方政府执行力的途径研究	*	26	516
6	政治学	True	28	新时代提升地方政府质量的制度和政策途径研究	*	27	517
6	政治学	True	29	新时代公务员行政伦理研究	*	28	518
6	政治学	True	30	新时代公务员工作满意度实证调查研究	*	29	519
6	政治学	True	31	新时代促进民营企业健康发展的党委和政府职能与政策研究	*	30	520
6	政治学	True	32	新时代中国特色超特大规模城市治理研究	*	31	521
6	政治学	True	33	新时代京津冀一体化建设的行政管理体制改革研究	*	32	522
6	政治学	True	34	新时代乡村振兴与精准扶贫战略协同推进研究	*	33	523
6	政治学	True	35	中国特色社会主义参政党政治建设的任务及路径研究	*	34	524
6	政治学	True	36	中国特色社会主义新型政党体制的法理和机理研究	*	35	525
6	政治学	True	37	中国特色社会主义新型政党制度的社会、文化和政治基础研究	*	36	526
6	政治学	True	38	党牢牢掌握意识形态工作领导权的体制机制研究	*	37	527
6	政治学	True	39	地方党委与部门党组落实全面从严治党的体制与机制研究	*	38	528
6	政治学	True	40	加强和完善人民代表大会的监督职能研究	*	39	529
6	政治学	True	41	党委、人大和政府法规文件备案审查体制机制比较研究	*	40	530
6	政治学	True	42	人民政协作为统一战线组织研究	*	41	531
6	政治学	True	43	人民政协作为实行多党合作和政治协商制度重要政治形式和组织形式研究	*	42	532
6	政治学	True	44	人民政协作为国家治理体系的重要组成部分研究	*	43	533
6	政治学	True	45	人民政协制度与外国政治制度比较研究	*	44	534
6	政治学	True	46	以党的政治建设优化党内政治生态的实现路径研究	*	45	535
6	政治学	True	47	提高党的依法执政本领研究	*	46	536
6	政治学	True	48	新时代妇联组织职能定位研究	*	47	537
6	政治学	True	49	财政税收体制改革背景下的中央与地方事权划分和协同运行研究	*	48	538
6	政治学	True	50	国家治理现代化背景下的国家机关事务管理改革研究	*	49	539
6	政治学	True	51	地方机构职能改革背景下的党政关系研究	*	50	540
6	政治学	True	52	大数据在权力监督实践中的作用机理与实现机制研究	*	51	541
6	政治学	True	53	互联网与政府公共关系优化研究	*	52	542
6	政治学	True	54	经济高质量发展背景下的政府绩效考核研究	*	53	543
6	政治学	True	55	政府促进新旧动能转换的职能及其实现机制研究	*	54	544
6	政治学	True	56	核心技术自主创新的政府职能与公共政策研究	*	55	545
6	政治学	True	57	完善地方政府执行政策方式研究	*	56	546
6	政治学	True	58	促进人才向基层流动的体制机制创新研究	*	57	547
6	政治学	True	59	保护知识产权的政府职能及其实现机制研究	*	58	548
6	政治学	True	60	党委和政府优化民营企业发展环境的职能及其实现机制研究	*	59	549
6	政治学	True	61	优化事业单位国有资产管理体制机制和政策研究	*	60	550
6	政治学	True	62	政府向社会力量购买公共服务的绩效评估和质量保障机制研究	*	61	551
6	政治学	True	63	扩大和保障劳动者民主管理权的体制机制和政策路径研究	*	62	552
6	政治学	True	64	基层党建促进基层治理机制创新研究	*	63	553
6	政治学	True	65	社会组织参与社会治理模式研究	*	64	554
6	政治学	True	66	基层协商民主的运行机制和制度化建设研究	*	65	555
6	政治学	True	67	实施粤港澳大湾区战略的政府合作协同体制机制研究	*	66	556
6	政治学	True	68	实施长三角一体化发展战略的行政体制优化研究	*	67	557
6	政治学	True	69	健全党组织领导下的自治法治德治相结合的乡村治理体系研究	*	68	558
6	政治学	True	70	农村土地流转过程中的政府职能及其实现机制研究	*	69	559
6	政治学	True	71	乡村振兴战略背景下加强和优化政府“三农”工作职能研究	*	70	560
6	政治学	True	72	乡村振兴战略背景下农村社区治理现代化研究	*	71	561
6	政治学	True	73	新型城镇化背景下妇女在乡村治理中的作用研究	*	72	562
6	政治学	True	74	当代中国国家认同建构的政治话语建设与创新路径研究	*	73	563
6	政治学	True	75	我国边疆民族地区长期政治稳定机制研究	*	74	564
6	政治学	True	76	多民族国家国民塑造的机制与经验研究	*	75	565
6	政治学	True	77	基本公共服务均等化与增强边疆民族地区政治认同的关系研究	*	76	566
6	政治学	True	78	民族地区公民参与地方治理的制度优化研究	*	77	567
6	政治学	True	79	构建党委领导下的多主体参与和多种手段相结合的综合治网格局研究	*	78	568
6	政治学	True	80	网络极端民族主义的风险防范研究	*	79	569
6	政治学	True	81	香港澳门助力国家全面开放的政策机制研究	*	80	570
6	政治学	True	82	香港澳门融入国家发展大局的政策机制研究	*	81	571
6	政治学	True	83	香港澳门参与国家治理实践的机制研究	*	82	572
6	政治学	True	84	台湾选举政治对于国家统一的影响研究	*	83	573
6	政治学	True	85	增强海外侨胞中华民族共同体认同的政治机制研究	*	84	574
6	政治学	True	86	不同政体模式与国家治理绩效比较研究	*	85	575
6	政治学	True	87	不同国家地方治理发展模式的比较研究	*	86	576
6	政治学	True	88	不同政治体制竞争性共存的战略与策略研究	*	87	577
6	政治学	True	89	西方政党体制面临的问题与挑战研究	*	88	578
6	政治学	True	90	当代美国政治发展演化研究	*	89	579
6	政治学	False	91	新时代国家政治安全理论研究		90	580
6	政治学	False	92	国家治理现代化的理论基础研究		91	581
6	政治学	False	93	中国特色社会主义政治体制的文明基础与历史根基研究		92	582
6	政治学	False	94	近百年中国政治学学科发展史研究		93	583
6	政治学	False	95	近百年中国政治思想史研究范式及方法反思		94	584
6	政治学	False	96	中国传统儒家政治意识形态的长期稳定与阶段调适研究		95	585
6	政治学	False	97	中国传统政治文化的价值结构与内在逻辑研究		96	586
6	政治学	False	98	中国政治决策案例库建设		97	587
6	政治学	False	99	中国公共决策模拟仿真系统建设		98	588
6	政治学	False	100	20世纪以来国家理论发展演变研究		99	589
6	政治学	False	101	政治制度主义理论和方法研究		100	590
6	政治学	False	102	当代政党和政党制度理论研究		101	591
6	政治学	False	103	当代代表理论和制度研究		102	592
6	政治学	False	104	现当代国家主权理论和实施机制研究		103	593
6	政治学	False	105	当代国家治理现代化理论研究		104	594
6	政治学	False	106	现实主义政治学与利益分析途径研究		105	595
6	政治学	False	107	行为主义政治学的哲学基础和方法研究		106	596
6	政治学	False	108	政治权力理论与分析路径研究		107	597
6	政治学	False	109	社会政治生活的公共利益和命运共同体的政治哲学研究		108	598
6	政治学	False	110	权利政治与公益政治的政治哲学比较分析		109	599
6	政治学	False	111	政治生态学理论与方法研究		110	600
6	政治学	False	112	政治社会学理论与方法研究		111	601
6	政治学	False	113	政治心理学理论与方法研究		112	602
6	政治学	False	114	地缘政治学理论与方法研究		113	603
6	政治学	False	115	比较政治学理论与方法研究		114	604
6	政治学	False	116	公共政策理论与方法研究		115	605
6	政治学	False	117	当代中国公共政策数据库建设		116	606
6	政治学	False	118	国家机关运行保障管理基础理论研究		117	607
6	政治学	False	119	中华优秀传统政治文化创造性转化研究		118	608
6	政治学	False	120	政治学研究方法研究		119	609
6	政治学	False	121	人工智能与政治科学发展相互关系研究		120	610
6	政治学	False	122	大数据与国家治理现代化相互关系研究		121	611
6	政治学	False	123	近代西方政治体制的文明基础研究		122	612
6	政治学	False	124	中西方政党制度比较研究		123	613
6	政治学	False	125	西方共和主义理论的当代演化研究		124	614
